{
  "schema_id": "forgewrite.knowledge_entry.v1",
  "id": "03b74f4c-74b9-42eb-8ef3-1f562c6153cd",
  "title": "Python async HTTP client \u2014 use httpx.AsyncClient",
  "description": "Use httpx.AsyncClient with async context manager for async HTTP requests in Python.",
  "tags": [
    "python",
    "async",
    "http",
    "httpx"
  ],
  "language": "python",
  "source_run_id": "seed-004",
  "problem_statement": "Need to make async HTTP requests in Python for LLM API calls.",
  "operations": [
    {
      "op": "create_file",
      "path": "src/client.py",
      "content": "import httpx\nfrom typing import Any\n\nasync def fetch_json(url: str) -> dict[str, Any]:\n    async with httpx.AsyncClient(timeout=30.0) as client:\n        resp = await client.get(url)\n        resp.raise_for_status()\n        return resp.json()\n"
    }
  ],
  "validation_summary": {
    "passed": true,
    "commands_run": [
      "pytest",
      "ruff check",
      "mypy"
    ]
  },
  "status": "active",
  "curator_notes": "Core pattern for ForgeWrite client code.",
  "created_at": "2026-06-16T16:34:21.288709+00:00",
  "promoted_at": "2026-06-16T16:34:21.288709+00:00",
  "usage_count": 1
}