{
  "schema_id": "forgewrite.knowledge_entry.v1",
  "id": "86e89801-7ab2-4828-ae97-148ce3bc8256",
  "title": "Fix gen keyword in Rust edition 2024 \u2014 use edition 2021",
  "description": "Change Cargo.toml edition to 2021 when gen keyword causes compile errors. Or use r#gen() syntax.",
  "tags": [
    "rust",
    "compile-error",
    "fix"
  ],
  "language": "rust",
  "source_run_id": "seed-003",
  "problem_statement": "Rust compiler error: expected identifier, found keyword gen. Edition 2024 reserves gen keyword.",
  "operations": [
    {
      "op": "replace_line_range",
      "path": "Cargo.toml",
      "start_line": 3,
      "end_line": 3,
      "content": "edition = \"2021\""
    }
  ],
  "validation_summary": {
    "passed": true,
    "commands_run": [
      "cargo check"
    ]
  },
  "status": "active",
  "curator_notes": "Critical pattern \u2014 models default to edition 2024 which breaks rand::Rng::gen().",
  "created_at": "2026-06-16T16:34:21.288709+00:00",
  "promoted_at": "2026-06-16T16:34:21.288709+00:00",
  "usage_count": 1
}